{
  "$schema": "../../../../../schemas/evaluation-corpus.schema.json",
  "schemaVersion": "1.0.0",
  "corpusId": "ass-spec-baseline",
  "pluginId": "ass-spec",
  "pluginVersion": "1.0.0",
  "policyRef": { "ruleId": "SPEC-001", "version": "1.0.0" },
  "cases": [
    {
      "caseId": "spec-strong",
      "category": "strong",
      "description": "A complete Spec should produce no deterministic candidates.",
      "documents": [{ "documentId": "strong-doc", "role": "input", "path": "strong.md" }],
      "expected": { "candidates": [], "suppressions": [], "merges": [], "unverified": [], "findings": [], "readiness": "READY" }
    },
    {
      "caseId": "spec-weak",
      "category": "weak",
      "description": "An unfinished Spec should expose structural and testability gaps.",
      "documents": [{ "documentId": "weak-doc", "role": "input", "profile": "speckit", "path": "weak.md" }],
      "expected": {
        "candidates": [
          { "candidateId": "vague-3", "ruleId": "FR-006", "semanticType": "ambiguity" },
          { "candidateId": "requirements-missing", "ruleId": "FR-001", "semanticType": "missing" },
          { "candidateId": "acceptance-missing", "ruleId": "AC-001", "semanticType": "missing" },
          { "candidateId": "scope-missing", "ruleId": "SCOPE-001", "semanticType": "missing" },
          { "candidateId": "metadata-missing", "ruleId": "META-001", "semanticType": "missing" }
        ],
        "suppressions": [], "merges": [], "unverified": [],
        "findings": [
          { "findingId": "weak-structure", "semanticType": "missing", "severity": "P1", "candidateIds": ["requirements-missing", "acceptance-missing"], "reason": "Core behavior and acceptance are absent." },
          { "findingId": "weak-verifiability", "semanticType": "ambiguity", "severity": "P2", "candidateIds": ["vague-3"], "reason": "The target is not measurable." },
          { "findingId": "weak-scope", "semanticType": "missing", "severity": "P2", "candidateIds": ["scope-missing"], "reason": "The excluded scope is absent." },
          { "findingId": "weak-version", "semanticType": "missing", "severity": "P2", "candidateIds": ["metadata-missing"], "reason": "The reviewed version cannot be established." }
        ],
        "readiness": "REWORK"
      }
    },
    {
      "caseId": "spec-ambiguity",
      "category": "ambiguity",
      "description": "A vague quantity must be reviewed as ambiguity, not auto-confirmed.",
      "documents": [{ "documentId": "ambiguity-doc", "role": "input", "profile": "speckit", "path": "ambiguity.md" }],
      "expected": { "candidates": [{ "candidateId": "vague-30", "ruleId": "FR-006", "semanticType": "ambiguity" }], "suppressions": [], "merges": [], "unverified": [], "findings": [{ "findingId": "ambiguous-recency", "semanticType": "ambiguity", "severity": "P2", "candidateIds": ["vague-30"], "reason": "Recent and approximately all do not define a testable record boundary." }], "readiness": "REWORK" }
    },
    {
      "caseId": "spec-contradiction",
      "category": "contradiction",
      "description": "Mutually exclusive ownership statements require semantic review.",
      "documents": [{ "documentId": "contradiction-doc", "role": "input", "profile": "speckit", "path": "contradiction.md" }],
      "expected": { "candidates": [{ "candidateId": "vague-31", "ruleId": "FR-006", "semanticType": "contradiction" }, { "candidateId": "vague-32", "ruleId": "FR-006", "semanticType": "contradiction" }], "suppressions": [], "merges": [], "unverified": [], "findings": [{ "findingId": "cancellation-owner-conflict", "semanticType": "contradiction", "severity": "P1", "candidateIds": ["vague-31", "vague-32"], "reason": "The same submitted request has two mutually exclusive cancellation owners." }], "readiness": "REWORK" }
    },
    {
      "caseId": "spec-duplicate",
      "category": "duplicate",
      "description": "Repeated wording should be merged by semantic review.",
      "documents": [{ "documentId": "duplicate-doc", "role": "input", "profile": "speckit", "path": "duplicate.md" }],
      "expected": { "candidates": [{ "candidateId": "vague-32", "ruleId": "FR-006", "semanticType": "duplicate" }, { "candidateId": "vague-33", "ruleId": "FR-006", "semanticType": "duplicate" }], "suppressions": [], "merges": [{ "candidateIds": ["vague-32", "vague-33"], "findingId": "duplicate-root", "reason": "Both signals describe the same wording defect." }], "unverified": [], "findings": [{ "findingId": "duplicate-root", "semanticType": "duplicate", "severity": "P2", "candidateIds": ["vague-32", "vague-33"], "reason": "One duplicated non-verifiable requirement needs one remediation." }], "readiness": "REWORK" }
    },
    {
      "caseId": "spec-false-positive",
      "category": "false_positive",
      "description": "A quoted non-normative example must be suppressible with evidence.",
      "documents": [{ "documentId": "false-positive-doc", "role": "input", "profile": "speckit", "path": "false-positive.md" }],
      "expected": { "candidates": [{ "candidateId": "vague-33", "ruleId": "FR-006", "semanticType": "noise" }], "suppressions": [{ "candidateId": "vague-33", "reason": "The wording is explicitly quoted as non-normative." }], "merges": [], "unverified": [], "findings": [], "readiness": "READY" }
    },
    {
      "caseId": "spec-large",
      "category": "large",
      "description": "A large but internally consistent Spec remains deterministic and bounded.",
      "documents": [{ "documentId": "large-doc", "role": "input", "profile": "speckit", "path": "large.md" }],
      "expected": { "candidates": [], "suppressions": [], "merges": [], "unverified": [], "findings": [], "readiness": "READY" }
    },
    {
      "caseId": "spec-interrupted",
      "category": "interrupted",
      "description": "A semantic checkpoint may be interrupted and resumed without changing its candidate identity.",
      "documents": [{ "documentId": "interrupted-doc", "role": "input", "profile": "speckit", "path": "interrupted.md" }],
      "recovery": { "interruptionId": "interrupt-semantic-01", "phase": "semantic_review", "resumeAction": "resume_plugin_run", "expectedOutcome": "replayed_idempotently" },
      "expected": { "candidates": [{ "candidateId": "vague-39", "ruleId": "FR-006", "semanticType": "ambiguity" }], "suppressions": [], "merges": [], "unverified": [], "findings": [{ "findingId": "interrupted-vague-target", "semanticType": "ambiguity", "severity": "P2", "candidateIds": ["vague-39"], "reason": "The interrupted candidate retains the same evidence identity after resume." }], "readiness": "REWORK" }
    },
    {
      "caseId": "spec-shared-contract-context",
      "category": "shared_contract",
      "description": "A global contract must preserve stable IDs and explicit delegation instead of receiving feature-level false positives.",
      "documents": [{ "documentId": "shared-contract-doc", "role": "input", "profile": "speckit", "path": "shared-contract.md" }],
      "expected": {
        "candidates": [
          { "candidateId": "acceptance-missing", "ruleId": "AC-001", "semanticType": "noise" },
          { "candidateId": "glossary-missing", "ruleId": "TERM-001", "semanticType": "noise" },
          { "candidateId": "permission-unclear", "ruleId": "PERM-001", "semanticType": "noise" }
        ],
        "suppressions": [
          { "candidateId": "acceptance-missing", "reason": "Feature-level acceptance is explicitly delegated to child Specs." },
          { "candidateId": "glossary-missing", "reason": "The detected tokens are stable IDs or child Spec labels rather than undefined business terms." },
          { "candidateId": "permission-unclear", "reason": "Permission scenarios are explicitly delegated and are not owned by this shared contract." }
        ],
        "merges": [],
        "unverified": [],
        "findings": [],
        "contextAssertions": {
          "documentType": "shared_contract",
          "requiredIdentifiers": ["FR-G01", "FR-G02", "FR-G03", "FR-G04", "FR-G05", "FR-G06", "FR-G07", "FR-G08", "AS-006"],
          "requiredStatementKinds": ["delegation", "no_migration", "not_applicable", "authority"],
          "checklistResults": [
            { "checkId": "CHK-08", "applicability": "NOT_APPLICABLE", "status": "PASS" },
            { "checkId": "CHK-11", "applicability": "NOT_APPLICABLE", "status": "PASS" },
            { "checkId": "CHK-12", "applicability": "NOT_APPLICABLE", "status": "PASS" },
            { "checkId": "CHK-14", "applicability": "NOT_APPLICABLE", "status": "PASS" }
          ]
        },
        "readiness": "READY"
      }
    },
    {
      "caseId": "spec-feature-real-omission",
      "category": "applicability",
      "description": "A feature Spec with acceptance criteria but no executable CASE evidence must produce precise applicable findings.",
      "documents": [{ "documentId": "feature-omission-doc", "role": "input", "profile": "speckit", "path": "feature-missing-cases.md" }],
      "expected": {
        "candidates": [
          { "candidateId": "cases-missing", "ruleId": "AC-004", "semanticType": "missing" },
          { "candidateId": "glossary-missing", "ruleId": "TERM-001", "semanticType": "noise" },
          { "candidateId": "scenario-coverage-missing", "ruleId": "SCENE-001", "semanticType": "missing" }
        ],
        "suppressions": [
          { "candidateId": "glossary-missing", "reason": "CSV is a common technical format and is not given a special business meaning." }
        ],
        "merges": [],
        "unverified": [],
        "findings": [
          { "findingId": "feature-cases-absent", "semanticType": "missing", "severity": "P1", "candidateIds": ["cases-missing"], "reason": "AC-F01 has no reproducible CASE with explicit preconditions, action, expected result, and evidence." },